coluna,descricao,unidade,origem
per_capita_electricity,Geração total de eletricidade por pessoa - Medida em quilowatts-hora por pessoa.,kilowatt-hours,Ember - Yearly Electricity Data (2024) [https://ember-climate.org/data-catalogue/yearly-electricity-data/]
primary_energy_consumption,Consumo de energia primária - Medido em terawatts-hora.,terawatt-hours,U.S. Energy Information Administration - International Energy Data (2023) [https://www.eia.gov/opendata/bulkfiles.php]
renewables_cons_change_pct,Variação percentual anual no consumo de energias renováveis,%,Energy Institute - Statistical Review of World Energy (2023) [https://www.energyinst.org/statistical-review/]
renewables_cons_change_twh,Variação anual no consumo de energias renováveis,terawatt-hours,Energy Institute - Statistical Review of World Energy (2023) [https://www.energyinst.org/statistical-review/]
renewables_consumption,"Consumo de energia primária proveniente de fontes renováveis ​​- Medido em terawatts-hora, utilizando o método de substituição.",terawatt-hours,Energy Institute - Statistical Review of World Energy (2023) [https://www.energyinst.org/statistical-review/]
renewables_elec_per_capita,Geração de eletricidade a partir de fontes renováveis ​​por pessoa - Medida em quilowatts-hora por pessoa.,kilowatt-hours,Ember - Yearly Electricity Data (2024) [https://ember-climate.org/data-catalogue/yearly-electricity-data/]
renewables_electricity,Geração de eletricidade a partir de fontes renováveis ​​- Medida em terawatts-hora.,terawatt-hours,Ember - Yearly Electricity Data (2024) [https://ember-climate.org/data-catalogue/yearly-electricity-data/]
renewables_energy_per_capita,Consumo de energias renováveis ​​per capita - Medido em quilowatts-hora por pessoa.,kilowatt-hours,Energy Institute - Statistical Review of World Energy (2023) [https://www.energyinst.org/statistical-review/]
renewables_share_elec,Quota de electricidade gerada por energias renováveis ​​- Medida como percentagem da electricidade total.,%,Ember - Yearly Electricity Data (2024) [https://ember-climate.org/data-catalogue/yearly-electricity-data/]
renewables_share_energy,"Percentagem do consumo de energia primária proveniente de fontes renováveis ​​- Medida em percentagem da energia primária total, utilizando o método de substituição.",%,Energy Institute - Statistical Review of World Energy (2023) [https://www.energyinst.org/statistical-review/]
solar_cons_change_pct,Variação percentual anual no consumo de energia solar - Os números baseiam-se na geração bruta e não consideram o fornecimento de eletricidade transfronteiriço.,%,Energy Institute - Statistical Review of World Energy (2023) [https://www.energyinst.org/statistical-review/]
solar_cons_change_twh,"Variação anual no consumo de energia solar - A energia equivalente de entrada, em terawatts-hora, baseia-se na geração bruta e não considera o fornecimento de eletricidade transfronteiriço.",terawatt-hours,Energy Institute - Statistical Review of World Energy (2023) [https://www.energyinst.org/statistical-review/]
solar_consumption,"Consumo de energia primária proveniente de energia solar - Medido em terawatts-hora, utilizando o método de substituição.",terawatt-hours,Energy Institute - Statistical Review of World Energy (2023) [https://www.energyinst.org/statistical-review/]
solar_elec_per_capita,Geração de eletricidade a partir da energia solar por pessoa - Medida em quilowatts-hora por pessoa.,kilowatt-hours,Ember - Yearly Electricity Data (2024) [https://ember-climate.org/data-catalogue/yearly-electricity-data/]
solar_electricity,Geração de eletricidade a partir de energia solar - Medida em terawatts-hora.,terawatt-hours,Ember - Yearly Electricity Data (2024) [https://ember-climate.org/data-catalogue/yearly-electricity-data/]
solar_energy_per_capita,Consumo de energia solar per capita - Medido em quilowatts-hora por pessoa.,kilowatt-hours,Energy Institute - Statistical Review of World Energy (2023) [https://www.energyinst.org/statistical-review/]
solar_share_elec,Parcela de eletricidade gerada por energia solar - Medida como porcentagem da eletricidade total.,%,Ember - Yearly Electricity Data (2024) [https://ember-climate.org/data-catalogue/yearly-electricity-data/]
solar_share_energy,"Percentagem do consumo de energia primária proveniente da energia solar - Medida em percentagem da energia primária total, utilizando o método de substituição.",%,Energy Institute - Statistical Review of World Energy (2023) [https://www.energyinst.org/statistical-review/]
wind_cons_change_pct,Variação percentual anual no consumo de energia eólica - Os números baseiam-se na produção bruta e não consideram o fornecimento de eletricidade transfronteiriço.,%,Energy Institute - Statistical Review of World Energy (2023) [https://www.energyinst.org/statistical-review/]
wind_cons_change_twh,"Variação anual no consumo de energia eólica - A energia equivalente de entrada, em terawatts-hora, baseia-se na geração bruta e não considera o fornecimento de eletricidade transfronteiriço.",terawatt-hours,Energy Institute - Statistical Review of World Energy (2023) [https://www.energyinst.org/statistical-review/]
wind_consumption,"Consumo de energia primária proveniente da energia eólica - Medido em terawatts-hora, utilizando o método de substituição.",terawatt-hours,Energy Institute - Statistical Review of World Energy (2023) [https://www.energyinst.org/statistical-review/]
wind_elec_per_capita,Geração de eletricidade a partir da energia eólica por pessoa - Medida em quilowatts-hora por pessoa.,kilowatt-hours,Ember - Yearly Electricity Data (2024) [https://ember-climate.org/data-catalogue/yearly-electricity-data/]
wind_electricity,Geração de eletricidade a partir da energia eólica - Medida em terawatts-hora.,terawatt-hours,Ember - Yearly Electricity Data (2024) [https://ember-climate.org/data-catalogue/yearly-electricity-data/]
wind_energy_per_capita,Consumo de energia eólica per capita - Medido em quilowatts-hora por pessoa.,kilowatt-hours,Energy Institute - Statistical Review of World Energy (2023) [https://www.energyinst.org/statistical-review/]
wind_share_elec,Parcela de eletricidade gerada pela energia eólica - Medida como porcentagem da eletricidade total.,%,Ember - Yearly Electricity Data (2024) [https://ember-climate.org/data-catalogue/yearly-electricity-data/]
wind_share_energy,"Percentagem do consumo de energia primária proveniente da energia eólica - Medida em percentagem da energia primária total, utilizando o método de substituição.",%,Energy Institute - Statistical Review of World Energy (2023) [https://www.energyinst.org/statistical-review/]